title,id,category,transcript
Purchase College Environmental Studies,PW5b-jggZkc,environmental studies,"(happy and bright acoustic guitar music) - The way I go about preparing students is I try to demonstrate for them, by example. I mean I try to give them some time to experiment with it. So that when they get done, they don't just know facts, but they know how to get to the right answers. And that's far more important than just knowing the right answers. (happy and bright acoustic guitar music) - So all the ENV professors are like really, really hands on and like really always willing to go above and beyond for their students. They're always available, always open for any questions, any answers. Dr. Taylor literally went outside with me to help me with my senior project half and hour before he had a meeting in dress pants, dress shoes and a button up and trudged through the mud with me. So I can honestly say I do not think there's anything he would not do for his (laughs) students. - Our students are pretty awesome. And we have a really fairly small program, so we really get to know all of our students. I had a whole bunch come to Maine with me this past summer to do field work. We want to plan this garden that we're gonna plant, which is all them kind of outside of class time just being interested. Getting students out in the field and doing things outside and really engaging with what things look like in the real world. We try to get them doing a project that would be similar to what they would do in a masters program or in a Phd. So, it's intense. And we're really in vested in all of our students succeeding, so that's something that you're not gonna get at a huge school. And that you get here. (happy and bright acoustic guitar music)"
Washington Park Environmental Studies,yFJKWR70_6I,environmental studies,Washington Park is a horticulture school we have three different pathways we have animal science plant science and we have industrial small industrial power or industrial engines I love our programs landscaping I get hands-on experience I get to go out to our beds I get to go out to our yard and put my implements of design I learned about different rules different ways design blows and we get to see our creations to come to life here you get that hands-on action to actually work with the animals we come back here every single day clean cages take care of them grow feed them whenever you come in especially in the spring and in the fall you'll see the students outside they are managing the laws manicuring the lawns managing the greenhouses you can see every bed in our campus is designed by students so we come up with a design during this fall winter months and then a spring we implement our designs and our designs have to follow a strict rule system so you learn hands-on like these are going to be doing in the workforce it's actually really fun because a lot of people don't have this kind of opportunity so like hey we're working with real animals and real plants hands-on like we're not out somewhere else we get to do that right on our own campus we get to go out and we are one with the environment because we are actually located on the Metroparks campus so we go out and we tend then you do things that other schools don't do we're situated right inside of Washington Park which is part of the Cleveland Metroparks so we deal with the Rangers where you know most students don't deal with the Park Rangers they're part of our our structure here I think this is a really good school because the teachers they actually like work with you and they actually care about you and your grade and they're in it for the kids I can walk down the hallway right now and I can name every teacher I have a name every student I walk by me so see who I really am and not I'm more than just a test score you have that that really individual focus that hands-on learning experience and we were truly a nice little family and in a close-knit community here so landscape is this basically the study of the environment how you can make the environment work best for you planting a life you got to figure out how you can make your life work best for you and this school has really connected me to that deeper part of myself [Music]
Environmental Studies: A Global Perspective | CurtinX on edX | Course About Video,zf7GWuIYiSE,environmental studies,"PROFESSOR TERI BALSERThose of us who are alive today were born into a world that's changing faster and facing more challenges than at any other time in history. There those who say the problems can't be fixed. But some of us know better. We know it can be turned around. But it will take the efforts of all of us, spanning areas like science, technology, arts, policy, law, even philosophy. Crossing international boundaries and cultural divides. It may seem daunting, but it can be done. Every day, all around us people are changing the world. This course is a chance to join with the community of people all around the world that want to help solve the problems. It it, you're going to have a chance to learn some of the basics about environmental studies that we need to know in order to address the challenges that we face. A little knowledge really can go a long way. So if you're interested in making a difference, I invite you to join us and help make the world a better place."
Graduate Studies in Environmental Studies,5pp_aPS58os,environmental studies,"[ Music ] >> My experience as a graduate student at Queen's has been incredible. I've worked collaboratively with a variety of professors on campus, I've been fortunate enough to travel for field work internationally, so those experiences have been incredible. >> It's been really a very positive experience. It's a very tight-knit community, very supportive, and a lot of broad research areas that bolster your own research. >> We have research going on in the hard sciences, social sciences and studies, chemistry, biology, toxicology. We have projects in the humanities. We're joint with geology and geography. It's limitless, and that's one of the true benefits and powers of this school. >> Queen's School of Environmental Studies really offers students an opportunity to engage with like-minded individuals that are fully committed to environmental sustainability. We really appreciate working in multifaceted teams for research that is both theoretically grounded and empirically evidenced. So, what we're really wanting to do is ensure that environmental issues are seen from a big-picture perspective, and that we train our students around professional development skills that helps us translate that knowledge into the public, private, and community realms. >> Our graduate students have a variety of career paths they can choose from. We range from industry to government and non-government organizations. We have students go on to med school. We have students go on to work for Natural Resources Canada. It's not just academics that our students work on. There's really endless amounts of opportunity, and one of the best things about our program is that students can really get out what they put into it, and we're always sure not to limit their dreams or goals after their graduate studies. >> Graduate courses in this program are designed to challenge the way that you would normally think, so coming from my background, I had to really challenge my way of thinking, and fostering really critical thinking was really important in my education. >> I think one of the things that I value most about our school is the collaborative nature, and the open-door policy between students and professors. I've learnt so much through both formal and informal dialogue with professors in this school. [ Music ]"
Binghamton Major Minute - Environmental Studies,IkHdPiOe2rk,environmental studies,"[Music] Hey. My name is Eliana Ebstein. I'm an Environmental Studies major. Today, I'm in the Greenhouse at Binghamton University. And, I'm going to tell you about my major in 60 seconds. So, when I was a freshman I was very confused about what I wanted to major in. I thought I maybe wanted to be in business school . . . It turns out I hated it. I found geography and through geography, I fell in love with environmental studies. My favorite class so far, has been ""Ecological Agriculture."". My professor has his own farm. So, he teaches us in a very hands-on approach. And, on Thursday, he's actually bringing in some worms. I could take home for my compost bin. Outside of class, I'm involved in Binghamton Food Rescue . . . which is an organization that reallocates food from supermarkets and farmers markets . . . to people in need within 24 hours. Also, next semester I'll be studying sustainability abroad, in Costa Rica . . . which I'm pretty excited about. Something that surprised me about this major was how well I can integrate it into my daily life. I changed the kinds of foods I eat and the activities I engage in. In 5-10 years, I see myself abroad with a Master's Degree in Public Administration . . . managing a nonprofit that utilizes recycled textiles. And, that is Environmental Studies in 60 seconds.  "
UM&#39;s Environmental Studies Graduate Program,4_9XVVmAcYw,environmental studies,"[Light, upbeat instrumental music] Genievieve:""I love the intersection between nature and people. Where do those two things start interacting."" Colin: ""It's really meant to be a conversation among disciplines. It's not just any one particular approach to studying the environment. Scientists and teachers and policymakers and writers, basically any direction you want to come at it, we're all meeting together and we're meant to be talking about it so that we can consider things in more than one light."" Caroline: ""I wanted to be surrounded by peers who were doing inspiring work, both academic work and creative work, and that was certainly true."" Nick: ""Some of the best writers alive were invited to come here and work with us. I don't know any other program that has that level of environmental humanities and environmental writing access."" Josh: ""The experience of being at the farm is not like a job and it's not like school. It's like something richer than both."" Nick: ""I lived at the FLAT which is the 'Form for Living with Appropriate Technology' for two years and that was an immediate community. I didn't know anybody when I first moved here."" Colin:""Environmental studies is really what you make of it. So, for example, I took a bunch of Environmental Studies classes, but I also took journalism classes and creative writing classes."" Genievieve: ""The professors are amazing, there's a sort of, they have both an activist hands-on kind of approach as well as being quite academic."" Caroline: ""It's hard to think of them as a group because they're all such individuals and that's really true in the EVSTprogram that you get to know the faculty as individuals."" Nick: ""They are here to fully, fully support their cohort of students and they just kind of transformed this idea of academia for me."" Colin: ""Missoula is so special for just the access to recreation and wilderness. True wilderness, not just, you know popular hiking trails, but you can go deep into the backcountry by yourself and have that relationship with nature."" Caroline: ""I wanted be at a place where there was a really established enviromental program and in a place that had a really established environmental community."" Colin: ""That is really important for studying environmentalism."" Nick: ""Makes sense to learn these principles at a graduate-level in a place like Missoula where there is unbelievable wilderness right outside my door."" [Light, upbeat instrumental music]"
Penn&#39;s Master of Environmental Studies Testimonial: Alison Fetterman,NlC7U1uGgLQ,environmental studies,"My name is Alison Fetterman. My concentration is environmental biology. I have a bachelor’s degree in biology. After my bachelor’s, I went on to work. I worked at a bird observatory for about seven years, working on field studies with songbirds doing nest searching and banding and learning anything you can do in the field with birds. I wanted to move on further, so I looked into master's degrees and found that Penn was a good match with their field studies. I wanted field work. I wanted to work with birds. I wanted flexibility and so, this program checked all of the boxes and it has really... it's been amazing. The classmates is one of the big perks of this program. They all come from these, from professional backgrounds from recent graduates, bachelor's degrees. They all bring something completely different and everyone's really excited to share and everyone's very open. So, we learn a lot from each other and everyone is open about it and they want to learn from each other. So, the classmates are really an amazing perk."
Environmental Studies at UVic,Wqi229BSOIw,environmental studies,"Well I think what really sets apart in environmental studies is that there's a really strong focus on experiential learning. A lot of the instructors in the environmental studies department make a really strong effort to give their students a play-spaced education, where they're not just in the classroom, but they're studying in an outdoor environment. When you're talking about, you know, environmental issues, you really need to be out in the community, but also exploring the social and political, and even economic aspects of that, and trying to wrap that all together into an integrated lens. Our courses engage some of our primary environmental challenges, like climate change, and explore how we can solve some of these vaccine challenges. UVic has huge potential as a living classroom for learning about restoration and food systems. We have the legacies of different historical landscapes. We have Coastal Douglas-Fir forests. We have Garry oak meadow systems. And then we have all those spaces that come together to create this unique, patchy environment, where we can learn about different types of eco-systems. How they interact? What are the possibilities for each one? It's an awesome place to learn."
Environmental Studies 100,NcWkziLEVmw,environmental studies,it's a black cherry it's a wild Cherrytree it's one thing to see drawings or pictures of trees and ecosystems but instead another thing to be in it and learn from it you learn it like that if you see it right in front of you witch hazel nope but I'll show you some witch hazel we get in the woods for environmental studies I can't imagine not being in the field for me it's the most important thing to do with the students and quite often many of them haven't done these kinds of activities in the field this class is really neat because like here you directly see like what the effect is being beside like a natural wetland and residential area of what it does so a lot of people don't think about it laughter I think I'm a big environmentalist I like identifying trees so that's what's probably coolest part of the day
Why I Chose Earth and Environmental Sciences,fd0jpf-X5Bs,environmental studies,[Music] hi COS of 2024 I just wanted to say congratulations I'm accepting your offer to environmental sciences here at McMaster it is an amazing program one of the things I love about it is how close you get to the people in your program as well as the professors as well as the earth science one geo three labs they are so fun you get really hands-on in in the field and you guys are gonna rock it get it Rock fun anyways hi my name is Lucas and I'm a fourth year student and environmental sciences the reason I chose the master university is because of all the academic opportunities in class through school of Earth and environmental science has to offer the most exciting part happens through the hands-on field courses where your classroom can go from the standard style here in Hamilton to the aquatic caves of the Bahamas while you first-year students out there don't forget to have fun and good luck after completing the Gateway program you can apply into any level to science program including the three offered by the school of geography and earth sciences which can prepare you to meet the course requirements to be certified as a professional geoscientist in Ontario I chose the earth and environmental science program because I wanted to have the freedom of customizing my degree to fit my goals whether you love chemistry ecology and climate sciences or government policy making and the fight against climate change you'll find a world of opportunity which will allow you to explore incredible fields of study and prepare you for a truly engaging future broaden your perspective of the world with a tightly knit earth and environmental science community the small program size allows for no shortage of experiential education opportunities such as internships and co-ops and there are many courses and labs that will train you to address environmental challenges from an interdisciplinary perspective [Music]
Environmental Studies Course Puts Students to Work in the Field,GaJeBtQjo_w,environmental studies,"[Music plays] So the specific research that I'm doing, I'm gonna be working on the soil composition to find out what will grow best here, and we also wanted to find out what's growing now, was the goal. So we came out and we did a survey of the area, and we counted plants to see what's growing now and how we can help other things that are native grow here too. We're working with the Boise River Enhancement Network and the City of Boise to help rehabilitate a 12-acre hillside of the Hyatt Hidden Wetlands Reserve here in Boise. It's a hillside that's just completely overgrown with invasive species, and we'd like to see it have more native bunchgrasses and annual forbs. We're really trying to show the value of wetlands, especially in urban settings like here in Boise, so what part of my research is is to collect air particulate samples throughout this 44-acre site and then compare them to other sites down the road and I want to use those particulates, see what the pollutants are, and kind of show that they are improving air quality and we should really care about wetlands and care about improving our environment by wetlands. What we're working on is measuring air quality levels around Boise and comparing them to a stationary monitor that's located in Meridian. And what we're kind of doing is we're looking at how air quality varies over a wide spacial area, as compared to just a single stationary monitor. So, greenbelt, obviously, the levels are much better than you'll see downtown. Downtown it tends to spike around rush hour, major intersections like Front and Capitol Street. Over here the air quality's a lot better, I would say. The intent of the research is to kind of see how the particulate matter and the air quality changes basically over really short distance. We're finding that there is, depending on time of day and what block you're on, there can be huge disparities, sometimes hundreds of times greater particulate matter 2.5 in the air from block to block, which is really interesting. So far that's a lot different from what I expected. That thing that I really want to find out is just how big of a difference there is between traveling on the greenbelt, like coming in downtown, because that way sensitive populations, it's nice to know if somebody wants to bike to work, what is the best, healthiest way for them to be getting to work, getting around where they need to go. We don't have enough information to say anything definitively yet, but once a year has rolled around, we can make some assumptions about how things change seasonally. [Music plays and fades out]"
Environmental Studies Class Attempts Sustainable Lifestyle,3Ho8GmsudQM,environmental studies,"I aim to go zero-carbon, yes, but also zero-waste in the ground zero-pollution in the air, zero resources sucked from the Earth, zero toxins in the water. I didn't just want to have no carbon impact, I wanted to have no environmental impact. Okay? And that's what no impact is supposed to be about. Transportation... Food... Energy... We want to bring cloth napkins, so that we don't have all the paper waste, and we want to bring Tupperware for leftovers so you don't waste any food. And in the dining halls, don't get a lunch tray unless you absolutely have to, because that wastes a lot of water to wash it. If you could take the stairs, just do it, taking the elevator isn't going to help your health in any way and taking the stairs will energize you before class and it might be a pain if you're all the way up on the fourth floor, but it's four flights of stairs. You can do it. And I think one of the important things that you guys had, or at least said last week, was that if something is broken, try to fix it first. You know, if you have jeans with holes in them, maybe you can get them patched first before you decide to go out and buy, buy new jeans. This is a problem for a couple of reasons. I mean, it takes a while to get rid of Styrofoam, we know that. The other thing is: look how much space this takes up. So, if we take up a lot of space with this, it's not biodegradable, it's going to last for a long time, so let's try to avoid Styrofoam next week. This is what is in my toolkit for no-impact week. I've got my mug, that I use in the mornings, okay, Here's my plastic container which they mentioned, Here's my water bottle that I'll take around, Bryn mentioned cloth napkins, I've got two,  'cause I'm messy, I found out last year when I did no impact that I make a lot of mess, and I'm constantly using paper towels, so I have two this year. Hopefully that will get me through it. This is for my composting items, okay? So, if I go around- like this morning I had a banana peel, I'll keep it in here, and then again, we're going to do composting in the classroom."
Penn&#39;s Master of Environmental Studies Testimonial: Tony Wang,GAXQC7wLjyQ,environmental studies,"Hi! My name is Tony Wang. I’m in the MES program. My concentration is resource management. For my future career, I’m interested in sustainability. I believe in that innovation and technology are the future, so I want to do some kind of environmental consulting or environmental technology to solve some of the current environmental issues like resource management, water scarcity, like pollution, and also, like conflicts between human and wildlife. I really like my classmates in the MES program because they are coming from different backgrounds. And there are lots of international students, which is really amazing because when we study the environmental issues, we have this global perspective. We want to see what’s going on around the world. I would definitely say to study and to grow at the University of Pennsylvania, you definitely have to be open-minded to learn from your classmate, learn from your professors. And also you have to take the initiative to learn on your own, to study, to initiate your own independent project. That is kind of the way you are becoming more independent, innovative yourself. And you are carrying out what you’re learning into your career interests."
Penn&#39;s Master of Environmental Studies: Meet the Students,GN882cirt8E,environmental studies,"Um, I think the most exciting part of my job everyday is coming in and seeing what these students are going to do next. They're doing everything. They're so involved. They're so engaged and, uh, the professors are willing to work with them and say, you know, someone comes in with a crazy idea, you know, I want to go do this and we're like, ok, how can we make that happen? And, typically we can make it happen. And that's the really fun part about this job is finding out, oh so and so just did this, so and so just did that. They just came back from this project or that project and, um, the way that they engage with each other and interact with each other, um, on these projects has been phenomenal. So, uh, they're working with each other, they're working with professors, and they're just really, um, they're non-stop. It's hard to keep up with them. So, our class comprises of people from various backgrounds and from various countries. So, that itself is, uh, an experience where you learn from each other. Which, someone has done supply chain management, so you learn, you learn from them on certain aspects but you get stuck on doing your project or understanding some things. People coming from civil engineering background, people from, um, environmental studies core studies like geology. So, there's a lot to share. People from different areas, some have come from right out of the undergrad, some have 10 years of experience, some are still working, some, some with, some doing second master's. So, yeah it's been, it's been nice. But, but honestly, and I know it sounds cliché but the students are really the most phenomenal. Uh, it's an aspect of, uh, the community here. They come from all over the world, they come from all over the US and different experiences, different strengths, so I do feel extremely fortunate to have had the opportunity to teach here all these years."
