title,id,category,transcript
"Dr. Yihsiang Liow: Associate Professor of Computer Science, Columbia College",Q3O7Xc3gVHU,computer science,"Computer Science is really everywhere. We are surrounded by computers. Now in terms of studying computer science at Columbia College, we have a small learning environment. Students interact among themselves and they have a good interaction with instructors too. So, they get to learn effectively and efficiently. Well one of my favorites would be Intro to Programming, Introduction to Programming, because that is when you get to see the new students. It is right at the beginning of the programming career or computer science career. The instructor will have a great impact and that is when perhaps interaction with students is maximal, when they are more dependent on the instructor. I think computer science is different from many other areas of study, because you have to solve problems. There is logical thinking and problem solving involved. At the same time whereas in other areas of study where you study the theory, in computer science you actually implement the theory. For instance, you can understand the logic behind a computer game and then you can write your own game. Students find that really exciting. Because of our small environment, students get to learn things effectively and efficiently. So the small environment allows us to really prepare students for their lives for professional life."
The fundamental theorem of arithmetic | Computer Science | Khan Academy,8CluknrLeys,computer science,"Imagine we are living in prehistoric times. Now, consider the following. How did we keep track of time without a clock? All clocks are based on some repetitive pattern which divides the flow of time into equal segments. To find these repetitive patterns, we look towards the heavens. The sun rising and falling each day is the most obvious. However, to keep track of longer periods of time, we looked for longer cycles. For this we looked to the moon, which seemed to gradually grow and shrink over many days. When we count the number of days between full moons, we arrive at the number 29. This is the origin of a month. However, if we try to divide 29 into equal pieces, we run into a problem. It is impossible. The only way to divide 29 into equal pieces is to break it back down into single units. 29 is a prime number. Think of it as unbreakable. If a number can be broken down into equal pieces greater than one, we call it a composite number. Now, if we are curious, we may wonder how many prime numbers are there, and how big do they get? Let's start by dividing all numbers into two categories. We list the primes on the left, and the composites on the right. At first they seem to dance back and forth. There is no obvious pattern here. So let's use a modern technique to see the big picture. The trick is to use a Ulam spiral. First we list all possible numbers in order in a growing spiral. Then we color all the prime numbers blue. Finally, we zoom out to see millions of numbers. This is the pattern of primes, which goes on and on forever. Incredibly, the entire structure of this pattern is still unsolved today. We are on to something. So let's fast forward to around 300 BC in ancient Greece. A philosopher known as Euclid of Alexandria understood that all numbers could be split into these two distinct categories. He began by realizing that any number can be divided down over and over until you reach a group of smallest equal numbers. And by definition, these smallest numbers are always prime numbers. So he knew that all numbers are somehow built out of smaller primes. To be clear, imagine the universe of all numbers, and ignore the primes. Now, pick any composite number and break it down, and you are always left with prime numbers. So Euclid knew that every number could be expressed using a group of smaller primes. Think of these as building blocks. No matter what number you choose, it can always be built with an addition of smaller primes. This is the root of his discovery, known as the fundamental theorem of arithmetic, as follows. Take any number, say 30, and find all the prime numbers it divides into equally. This we know as factorization. This will give us the prime factors. In this case, 2, 3, and 5 are the prime factors of 30. Euclid realized that you could then multiply these prime factors a specific number of times to build the original number. In this case, you simply multiply each factor once to build 30. 2 times 3 times 5 is the prime factorization of 30. Think of it as a special key, or combination. There is no other way to build 30 using some other groups of prime numbers multiplied together. So every possible number has one, and only one prime factorization. A good analogy is to imagine each number as a different lock. The unique key for each lock would be its prime factorization. No two locks share a key. No two numbers share a prime factorization."
What is cryptography? | Journey into cryptography | Computer Science | Khan Academy,Kf9KjCKmDcU,computer science,"Imagine two people who share an important secret have to split up. This requires them to communicate private information from a distance. However, an eavesdropper named Eve also wants this information, and has the ability to intercept their messages. So, Alice decides to communicate using letters written in some kind of secret code. The following analogy is helpful. First, Alice locks her message in a box, using a lock that only she and Bob know the combination to. This is known as 'encryption.' Then, the locked message is sent to Bob. When Bob receives the box, he opens it using the code they shared in advance. This is called 'decryption.' Cryptography begins when we abandon physical locks and use 'ciphers' instead. Think of [ciphers] as virtual locks. Ciphers allow Alice and Bob to scramble and descramble their messages so that they would appear meaningless if Eve intercepted them. Cryptography has been around for thousands of years. It has decided wars, and is at the heart of the worldwide communication network today. The fascinating story of cryptography requires us to understand two very old ideas related to number theory and probability theory."
The New Era of CS at UChicago: Expanding Data and Computer Science,AQgzcic0NiI,computer science,"MICHAEL FRANKLIN: The new John Crerar Library building is at the heart of our efforts to expand computer and data science at the University of Chicago. Today, computer science is deeply interconnected with many research disciplines. We're adding faculty and courses in critical topics such as data science, artificial intelligence, human computer interaction, and security. Our new modern space in Crerar reflects that spirit of collaboration across boundaries. We have new areas for faculty and students to work together, experiment with technology, and connect with the field's leading experts. The Media Arts, Data, and Design Center provides resources for game design and research, digital fabrication, data visualization, and GIS methods. The library's renovated collections and study areas preserve the building's original mission. We're excited for this new era of computer science at the University of Chicago, and we invite you to come visit us and our neighbors at the new John Crerar Library.  "
Master of Science in Computer Science: A Distinctive Program Creates Exceptional Graduates,D6uDVv4de-M,computer science,"""One of the unique things about our computer science program is that we have the areas of cybersecurity and digital forensics and networks that really help build up your computer science skills in today's society. We don't focus on one programming language. Many universities when you go to their curriculum you see that 'you know what we're just gonna teach them C, right? We have a different philosophy here at the University of New Haven. We think and we know in fact that by the time you graduate you're going to have to know multiple programming languages therefore by the time you graduate you must have at least experienced three programming languages, including Python which has been rated recently as one of the most used programming languages. We have for example a course in Introduction to Digital Forensics. We have a course in mobile device forensics. We have another course that's in reverse engineering. These are courses that will prepare you 100% to enter the workforce."""
Josh Caratelli | Computer Science | RMIT University,SHsHiq2q0zk,computer science,"So I really love computer science because it's a great mix of working with fantastic people and combining technical and creative skills. I've always been a huge gamer, I love playing games and the social interactions you have with games and it wasn't I met game developers in person that I realised how passionate and creative and just awesome they were; that I went, hang on I'd love to do this as a job. My name's Josh Cartelli, I'm studying at RMIT University doing second year computer science and my day job is a junior  gameplay programmer at big ant studios. RMIT was a very obvious choice for me for a couple of reasons. The first being just the culture, the people here are super nice, super passionate if you have an issue or if you want to extend yourself RMIT's there for you. And secondly, in my field of computer science and game development, people overseas have heard of RMIT, and that just goes a long way. For me some of the biggest skills I've gained aren't the most obvious ones. Sure there's lots of technical math knowledge I learn in my classes, but the biggest one is working together with a team, how can you work together to achieve a common goal. One of my major achievements so far was launching iPhone game with my friend Liam McLaughlin. It's called Smog Game and teaches kids about saving the environment. We even created own company and talked to Apple reps and PwC and Epic and it was really cool just to go from this very small idea to actually have a finished product. I think the future of computer science and game development is heavily leaning towards tech such as AR and VR, but the thing I think people overlook the most is the democratisation of game development and app development. Anyone can get started now, tools are becoming cheaper or free, and just as a bedroom coder make your dream idea into reality, really."
Teach Computer Science with Minecraft: Education Edition,jSoewKbJZEw,computer science,Start your coding journey with over 150 hours  of computer science curriculum in Minecraft: Education Edition. Begin by learning introductory coding concepts with Hour of Code! Continue block-based coding with CODING FUNDAMENTALS. Then begin learning text-based coding in JavaScript or even Python! Your journey will take you from the arctic animal research center to the rings of Saturn to awesome floating islands! Use your creativity to build unique solutions to coding problems. Start Coding today!
What is Biology?,6v8djXa-IPQ,biology,"What is Biology? You may have learned to classify a rose or a human as living, rock and water as non-living. But why is this so? If you say that ""living"" is something that moves, but then flowing water can be called ""living"". Right? That's not entirely true. Life has a set of properties that an organism has to follow to be called ""living"". And a wonderful discipline of science studies life in great detail. It is called Biology. The word ""Bio"" means living, and ""logy"" means study. So Biology means the study of living things. Simply put: Anything which interacts with its environment, use energy and reproduce are known as living things. For example, we, humans, eat food to get energy, feel and respond to our environment, and reproduce to make more of ourselves. Many other living things like insects, birds, and animals have the same properties like us. So, they are all living organisms. Now the question arises how many types of living things are there? And how are they different from us? Biology is a field which answers these questions and many more questions related to living things. What is Biology? There are 7 characteristics that a living thing follows and therefore we study these in the vast field of biology. These are: One: Order If you examine a rose from near, you will notice it is very ordered. The petals are folded around each other with the center-bearing seeds. This illustrates the highly ordered structure that typifies life. Living cells are the basis of this complex organization. Two: Reproduction Organisms reproduce their own kind. A mother giant panda will always give birth to a panda, not a horse. We learned that from Kungfu Panda, too. Three: Growth and Development Inherited information in the form of DNA controls the pattern of growth and development of all organisms. You most probably look like your parents or close relative, thanks to the genes. Four: Energy Processing We, humans, eat food to get energy. The food we eat has also eaten some food to utilize its chemical energy stored in order to power its own activities and chemical reactions. Five: Responds to the environment All organisms respond to environmental stimuli. This is why you laugh when you're tickled. Six: Regulation Many types of mechanisms regulate an organism's internal environment. Keeping it within limits that sustain life. This is also called homeostasis. A lemur sunbathes to help raise the animal's body temperature on cold mornings. Seven: Evolutionary Adaptation Lions use camouflage to blend in with the savanna so they can easily hunt down an animal. Such adaptations evolve over many generations. Some new concepts like genes and DNA are introduced in this video. These will be explained in our upcoming videos. Stay tuned!"
Biology: Cell Transport,ufCiGz75DAk,biology,"Cell transport is the process of how things move in or out of the cell through the cell membrane There are two broad categories of cell Transport The first Category is passive transport, for a cell passive transport means It's an automatic process that doesn't require any input of energy for example Diffusion is a passive process in which particles move either into or out of the cell from an area of higher concentration to an area of lower concentration The cell doesn't use any energy when this happens The second Category of cell Transport is active Transport This is when particles move from an area of lower concentration to an area of higher concentration when particles move against the concentration gradient Energy is required often to allow protein pumps to assist in Particle Movement why would the cell need to move particles from a low to high concentration and expend energy to do it An Important example is seen in your heart muscle cells In order for your heart to beat there are certain molecules that have to move from an area of low concentration to an area of high concentration for those cardiac muscle cells to work So the main things to remember are passive transport happens automatically with no energy required while active transport needs energy for it to occur  "
"Oh, Biology (From the Disney Channel Original Movie &quot;Freaky Friday&quot;)",NZ4BnBAWvVw,biology,"♪ ♪ ♪ I'm ace at all anatomies, a master of dissection ♪ ♪ An expert chef who wields an expert knife ♪ ♪ But still I sense a gremlin in this system of perfection ♪ ♪ There clearly are still mysteries to life ♪ ♪ Its kingdom, phylum, class and then it's order, family genus ♪ ♪ It all comes back to me like child's play ♪ ♪ Then he leans over my shoulder there in all his long and leanness ♪ ♪ And cuts my hard-earned knowledge clean away ♪ ♪ I try to keep a focused mind ♪ ♪ And steady hand ♪ ♪ But the rhythm of my heart ♪ ♪ Is like a country western band ♪ ♪ Oh, biology! ♪ ♪ What have you done to me? ♪ ♪ Why can't my grownup brain control my teenage parts ♪ ♪ Oh, biology! ♪ ♪ Why won't you let me be? ♪ ♪ Why can't you be humane ♪ ♪ And still our beating hearts ♪ ♪ Before the cutting starts ♪ ♪ She's so confident and cocky, it's a total transformation ♪ ♪ I'm sweating, but I'll try to play it cool ♪ ♪ But I open up my mouth to try to make some conversation ♪ ♪ And somehow end up sounding like a fool ♪ ♪ Yo, dude, that's sick, I'm way impressed, like, ♪ ♪ Sweet technique ♪ ♪ O.M.G! ♪ ♪ Um, like, totally, um thanks ♪ ♪ Come on now, can't I even speak? ♪ ♪ Oh, biology! ♪ ♪ What have you done to me? ♪ ♪ My over 40 soul is in a teen cliché ♪ ♪ Teen cliché ♪ ♪ Oh, biology! ♪ ♪ Why won't you set me free? ♪ ♪ 'Cause I'm not in control ♪ ♪ When hunger has its say ♪ ♪ And hormones have their way ♪ Focus, Blake. Focus. ♪ Hey, what is up with El today? ♪ ♪ She seems, well, kind of great ♪ ♪ She's always great-- but, yeah, it's nuts ♪ ♪ That girl is on my nerves today ♪ ♪ I better set her straight ♪ ♪ You better let her know what's what! ♪ ♪ I never knew that Ellie Blake was such a science whiz ♪ ♪ She's smart of course that much I knew ♪ ♪ But something's up with her today, I don't what it is ♪ ♪ But then just maybe I feel it too ♪ ♪ I feel it too ♪ ♪ We feel it too ♪ ♪ That girl is through! ♪ ♪ Oh, biology! ♪ ♪ Look what you've done to me ♪ ♪ My heart is in a pan ♪ ♪ My brain is out to sea ♪ ♪ Oh, biology! ♪ ♪ Why won't you let me be? ♪ ♪ Please help me if you can ♪ ♪ Please hear my painful plea ♪ ♪ Biology ♪ ♪ Biology ♪ ♪ Biology ♪ [bell rings] [chattering] Oops. Everyone, get out of the way. Savannah is coming through! ♪ Please set me free ♪ ♪ ♪"
What is Homeostasis? | Physiology | Biology | FuseSchool,quQr6X1Q58I,biology,"So what is homeostasis? Homeostasis is a term first defined by Claude Bernard in 1865. It means maintaining a constant internal environment. Wow, great, that really explains it doesn't it. Let me try and make it a bit clearer then. Imagine the cockpit of a plane, it is packed full of dials, And it is the pilot's job to make sure they all stay in the right place. If any of them change she will correct the plane to keep them in the right place and the plane in the air. This is a bit like how our brain works. Sensors all around the body are measuring various things and sending the information back to the brain. The brain then does its best to keep all these things stable and constant to keep the body working properly. This is homeostasis maintaining a constant internal environment. So what kind of things needs to be kept constant in the body? Well, it's very important to keep our temperature the same at around 37 degrees Celsius. You can find out more about this in the video on temperature regulation. You also need to keep the levels of sugar in the blood constant along with levels of ions and water. Your blood pressure needs to be carefully monitored along with the amounts of waste in the blood such as carbon dioxide and urea. Okay, so let's say one of these factors goes too high or low. What is the brain going to do to get it back to the normal levels? The answer to that is negative feedback. Negative feedback is the process where the brain uses either hormone or nervous system to send a signal to the part of the body that can rectify the problem. For example, after you eat a meal your blood sugar level increases You can see it on this graph. This is detected and the pancreas will release a hormone called insulin that causes the sugar to be stored in the liver. Therefore, as you can see on the graph, the blood sugar level returns to normal. Negative feedback is the loop from which the body detects the stimulus, reacts by responding accordingly, and brings the body back to the normal levels. So why is homeostasis so important? Our metabolism, which is all the chemical reactions in our bodies that keep us alive, is controlled by enzymes. These enzymes only work in very specific conditions. If these conditions change, they could stop working and we could die. Luckily all this happens without you having to think about it. If you had to do it yourself you would spend all day and night just trying to keep all these things constant. And would have no time to do anything fun like watch videos of cats on the internet."
WELL THIS IS AWKWARD: Matt Walsh has to educate biology student on biology,mB573AmATKw,biology,"Student: Hi. I thought you had some really good points, but I just wanted to ask you about hybrids and stuff because I'm here studying biology, and so we've learned a lot about genetic mutations, and disorders, and such, and there actually are hermaphrodite humans beings, where they have both ovaries and testicles. And that... I have it right here. It's actually a medical condition called ""ovotesticular disorder."" And there are also other genetic disorders where people are born with XXY, just X, or just Y, and such. And while it may seem rare, there are hundreds of thousands of people born with this each year. And so, going off of your fairytale hybrid people, they do exist, and I'm just wondering how that would play into your view of there being a spectrum of gender because... Walsh: These are people who can get pregnant and also impregnate someone else? Student: Yes. Hermaphrodites have both ovaries and testicles. Walsh: No. No. No. [Audience chattering] Walsh: If such a person existed, I would not include that part in my next speech, but... [Audience laughter] Walsh: ...such a person does not exist. Now, intersex and gender deformities, as you talked about, do exist, and I expected someone to bring that up in the Q and A. I think it's a fine point to bring up. Two things I would say to that. Number one, that actually has nothing to do with transgenderism because if when we're talking about transgender, we're talking specifically about intersex people, then we would just say ""intersex."" But with transgender, most of the time, we're talking about men who don't have any deformities, they are just straight-up men, clearly, and they are identifying as women. So even if I agree that what you're talking about is some sort of exception, that actually would have nothing to do with the transgender topic. But I don't think it is an exception because, as I said, I think a true resident of the middle circle of the Venn diagram would be someone who has the reproductive capabilities of both genders, and no one like that exists. I mean, not to be crude, but there isn't anyone who can get themselves pregnant, right? That doesn't exist in the human kingdom, anyway. So I think what you're talking about there are people who have deformities, and so in their case, it would be more difficult than usual to determine what their actual biological sex is because the usual indicators aren't there or aren't as obvious, but that doesn't mean that they don't have a biological sex. It's just not as clear."
Biologist Career Video,JcAUqJoUgBI,biology,"From the smallest microorganism to the giant blue whale, every living thing is of interest to biologists, who study the basic principles of plant and animal life. Biologists use the scientific method, testing their ideas or hypotheses through experimentation, to investigate questions about the origin of life, its development, and the relationships between living things, as well as a creature’s anatomy and how it functions in its environment. Whether they’re working in a lab, out in the field, or at a university, biologists collect and analyze biological data, although the specifics of their research are as varied as the creatures in nature. For example, some biologists may work almost exclusively with computer models, while others may spend months collecting and studying specimens at sea. Many specialize in working with plants, animals, or the environment. Biologists need strong communication skills. Their work is often as much about interacting with people and institutions as it is focusing on DNA or anatomy. A career in biology generally requires a bachelor’s degree in the field. Many biologists attend graduate school to earn more advanced research positions or professorships."
Biology Slander,vhRpLSwxKdw,biology,what can I say except the mitochondria  is the PowerHouse of the cell   it's a sacrifice I am willing to make idea 100% stolen from the internet years of Academy training wasted
