title,id,category,transcript
Biology: Independent vs. Dependent Variables,nqj0rJEf3Ew,biology,"""Independent variable"" and ""dependent variable"" are important terms related to controlled experiments. Remember, a controlled experiment is a scientific test in which all conditions are kept constant except for the variable you're testing. The independent variable is the thing you're testing in an experiment. it's often abbreviated as ""IV"" and sometimes called the ""manipulated variable"" because you change or manipulate this variable. In an experiment, the dependent variable is the thing you're observing and measuring the thing you're anticipating may be affected as a result of exposure to the independent variable. It's often abbreviated as ""DV"" and sometimes called the ""responding variable"" because it responds to the change that you make. Let's look at a few examples. Suppose your hypothesis is that if students study 15 minutes a night then they will have higher test grades than those who don't study at all. What's being changed, or manipulated? It's whether or not the student study for 15 minutes. And what's going to be observed or measured in this experiment? What do you think might be different as a result of this increased study time? You're expecting test grades will be affected. In this experiment, the independent variable is the study time. And the dependent variable - the thing you're measuring or going to observe - is the test grades. Here's another example - see if you can figure it out. This time the hypothesis is that if people who have headaches take aspirin, then they will get relief faster than those who who don't take aspirin for headaches. So, what's the thing that's different in this case? The thing that's different - the independent variable - is whether or not somebody is taking an aspirin. Then, what are you going to measure? Your measuring how long it takes for their headache to go away. That's the dependent variable. Here's a final example to help you understand these terms. You predict that if a brand-name light bulb is left on continuously, then it will burn longer than a bargain brand light bulb used in the same manner. In this case, what is the independent variable? It’s the brand name light bulb. What are you measuring? You're measuring how many hours the light bulbs work before burning out, which is the dependent variable. The independent variable is the brand name light bulb, and the dependent variable is the amount of time the light bulbs work before burning out. So to review, the independent variable is the thing that you're testing sometimes this is referred to as the cause in an experiment. It is also the ""if"" part of your hypothesis. The dependent variable the thing you're measuring is the effect. It is also the ""then"" part of your hypothesis."
What Are Hormones | Physiology | Biology | FuseSchool,lRJE8c3ghRE,biology,what are hormones a hormone is a chemical messenger that is secreted or released into our bloodstream by specific organs known as glands hormones regulate or control many processes in our body including blood glucose levels water content in blood general growth and blood pressure just to name a few as an example thyroxine which is a hormone secreted by a thyroid gland helps to regulate metabolism in other lessons you will learn about a few of these hormones in more detail several hormones are secreted by the pituitary gland located right below the hypothalamus in your brain instructions are given by the hypothalamus to the pituitary gland according to current conditions in our body the secreted hormones travel through the bloodstream to target organs where either a specific response is directly produced or it stimulates or causes the target organ to secrete its own hormones we can think of this like a post office system hormones or posts must reach the correct target organs or addresses for the right response to occur feeling thirsty when the hypothalamus detects low levels of water in blood it signals or tells the pituitary gland to release a hormone called the anti-diuretic hormone or adh into your bloodstream adh travels to your kidneys in this case the target organ and causes water to be absorbed so urine becomes more concentrated and output is decreased drinking more water increases the water content in your blood which then causes the hypothalamus to signal the pituitary gland to secrete less adh less adh means your kidneys will absorb less water causing urine to become less concentrated and output is increased ever felt suddenly frightened when threatened the brain activates neurons that stimulate the adrenal gland located right above your kidneys to rapidly secrete adrenaline adrenaline then acts on your heart and lungs to increase heart rate and breathing rate this along with other physiological responses is known as the fight-or-flight response and is activated very quickly at the same time the hypothalamus signals the pituitary gland to secrete the adrenocorticotropic hormone which travels to the adrenal glands to secrete a hormone known as cortisol cortisol acts in target organs to allow the body to adapt long-term distress so to review hormones are chemical messengers secreted by glands into the bloodstream and produce a specific response when they reach the target organ you
Synthetic Biology at Northwestern: Developing Cell-free Biology Systems,o1MC79GKk2s,biology,"[MUSIC PLAYING] One of the things that our lab is specializing in is the development of cell-free synthetic biology systems. This is really important, because it allows us to decouple cellular objectives from what engineering objectives might be. Imagine that I'm a cell living in the environment. My goal is not to produce insulin for you. It's not to produce a fuel for you. It's not to produce anything else. My goal is really to live and survive. And so rather than have to worry about keeping the cell alive, we basically take a living cell, we rip off the cell wall, and we collect the guts of the cell. So this is like the machinery that might make the product we want it to make, or it might sense a small molecule within the environment that we would like to sense. So that can be really useful if you want to make, for example, a toxic compound that would normally kill a cell. Now you can take all the components of a cell that would make that compound, and deconstruct it, and then put it back together. So you can think of this like if you had a car, and we're going to basically open the hood up, take the engine out, and put it over here, and then play with it. I think one of the powerful aspects of designing artificial cells is that we will be able to use and incorporate imaging molecules that might be helpful for us to detect disease, therapeutic drugs that might be helpful for us to treat disease, and we'll also be able to use these structures to move into extreme environments-- high pH environments, high temperatures-- to detect and respond to different biological compounds that we're interested in."
"Branches of Biology | biotechnolgy, botany,cell biology,chronobiology,conservation biology |",7Bk1j9jLbi0,biology,"Welcome to MooMooMath and Science. In this video, I will talk about five branches of biology. In this video, I cover, biotechnology, botany, cell biology, chronobiology, and conservation biologyBiotechnology:the science of using cellular and biomolecular processes to develop technologies and products Botany: the study of plants Cell Biology: The study of the structure and function of cells and their organelles Chronobiology: The study of how our body's natural cycles—mental, physical and emotional—are affected by solar and lunar rhythms. Conservation Biology: The study of how human impacts biological diversity study ways to prevent the extinction of species Thanks for watching MooMooMath and Science"
Master | Biological Sciences: General Biology (track) | University of Amsterdam,8FqcwfuB6sM,biology,"This programme is unique... because it allows students to really create their own programme. So the key words here are independence of the students... and irrespective of what you as a student want... we will help you in reaching your goals. In this programme you start out with a couple of courses... but most of the time is spent on projects, into research... or for instance honing your skills into societal problems or communication. I think I chose General Biology because I have very broad interests within the field of biology. And this track really allows me to pick and choose different courses... from all the various disciplines within the broad field of biology. So I think that's to be the flexibility that the programme gives you as a student. You're allowed to take courses from all the different tracks in the biological sciences master's. But it also allows you to for example extend your research project... if you really love doing research or even honing other types of skills. I think I would say it's not a bad thing to sort of stay curious have very broad interests. It's a good thing to know sort of the direction you want to go in terms of a job in a future... But it's never a bad thing to sort of diversify your skills, your knowledge or experience. So stay curious I would say. So far I've mainly focused on learning how to do research. I've done research projects at the University of Amsterdam... and I'm looking for another project outside of the university. But I've also very interested in science communication... learning how to communicate the results of science... back to society through media platforms. And this track also allows me to combine the two... so I'm planning to follow maybe a science communication major... after I complete my research internship... so I can really learn how to communicate science back to society."
Welcome to The Biology of Human Cancer Course!,E-Y6GH7gaSo,biology,"My name is Daniel Benhamin. And I've been an instructor at UC Berkeley Extension since 2017. I'll be teaching the biology of human cancer. I received my PhD from UC Berkeley in the field of cancer metabolism, where I studied how cancer cells metabolize nutrients differently from normal cells. And by understanding these metabolic differences, I was able to work towards developing chemotherapeutic strategies to specifically target cancer cells and not normal cells. You should take this biology of human cancer course if you're interested in understanding the fundamental mechanisms that allow a normal cell to become cancer. And by understanding these mechanisms, we can then be in a better position to understand how to both prevent and treat this devastating disease. The field of cancer biology is one of the most rapidly growing fields in all of science. And that is reflected in this class. The things that we learn have, often, only recently been discovered six to eight months before the class has started. In fact, at some point in the class, we will learn things that haven't even been discovered right now. And we'll learn about them together as they are being discovered. The reason why I love UC Berkeley Extension so much myself is because we cater to nontraditional students. We understand that students have jobs and lives outside of the classroom. And we try to foster a learning environment that caters specifically to these kinds of students. So not only will students be able to interact with both me and their fellow students in real time, live online on Zoom, but they'll also be able to interact with their fellow students on Canvas via discussion. So they can post a discussion question. And students can come at any time they want and answer that question. And in fact, what I find so amazing about this course and about the students who take this course is that because they come from such diversity of backgrounds, they can learn so much from each other."
Basic Molecular Biology: Laboratory Practice – The Laboratory Working Areas,cmM8TZdgWXk,biology,Laboratory materials must follow uni-directional  workflow through separate working areas to minimize   contamination. In the first step of a specimen  processing the PCR reagent mix is prepared in area A. In step 2 the prepared mix is transferred to area  B. Never transfer any laboratory materials from   Area B to Area A. In step 3 nucleic acid extraction is performed in Area B where the extracted nucleic acid from the specimen is added to the PCR reagent mix. In step 4 the PCR product goes through  an amplification process in Area C. In step 5 the post amplification PCR product is analyzed in Area D.
Department of Molecular and Cellular Biology (UNIGE),RLgoafysfnI,biology,"The aim is really to understand the basics of life from whole organisms down to the atomic structure of biomolecules essential for living cells. This fundamental knowledge of how cells grow, divide, differentiate into tissues or organism is absolutely essential for us to understand the mechanism underlying some diseases such as cancer, and to develop in the future new therapeutic approaches. The Department studies different topics, from genome stability, gene expression and chromatin regulation to signaling and cell cycle processes. And to tackle this important problem we use a wide range of methods from genetic to genome wide analysis, but also using CryoEM to understand the molecular architecture of the cell to an atomic level. Studying basic research in which probably the clinical translation of that is still very far away is fundamental. Fundamental not only because it's the first step into developing something that will be practical, but also because it's in the very human nature, trying to explore unknown territories, either geographically or intellectually. Being curious is probably the most fundamental part of being a scientist and having questions to answer is the first step into answering them. I think that the most interesting thing about how to generate good questions it really starts like earlier in your career,  probably as a PhD student or even before. The Department has been a pioneer in developing electron microscopy and many famous scientists have been hosted in the Department over the past decades and had a substantial contribution  in our current understanding of basic cellular and molecular processes. My lab uses biochemistry, molecular and cellular biology, super resolution and CryoEM to better understand how the cell divides and this at an atomic level. And we train our students with the most recent method and novel concept in biology to prepare them for the very rapidly evolving scientific world. We look for highly motivated and passionate students who want to step out of their comfort zone to undertake new challenging projects to better understand the really fascinating complexity of life and also uncover all the mechanistic details of how it all works."
Xylem and Phloem - Transport in Plants | Biology | FuseSchool,jtuX7H05tmQ,biology,"We could just say movement of water and minerals and movement of glucose and amino acids... But this is science, and so we like to have special terms to describe these processes! In these 3 part videos, we're going to look at the transport systems in plants for moving food, water and minerals around. We have a beating heart and circulating blood, but what do plants do? Cut a plant open, and it doesn't bleed. So what happens instead? Plants have their own systems. They have the Xylem which moves water and solutes from the roots to the leaves, and the Phloem which moves glucose, made in the leaves by photosynthesis, and amino acids to the rest of the plant. Here are the xylem and here are the phloem. Notice how the arrangement is different in the stem and the roots. The xylem and the phloem are found in groups called vascular bundles. And the position of these bundles changes for different parts of the plant. Both the xylem and the phloem are made up of rows of cells that form a continuous tube, running the whole length of the plant. The xylem vessels are made of elongated dead cells that are impermeable to water and have walls containing lignin (a woody material). Because of this, xylem vessels are tough. Which is why the vascular bundles in the roots are in the centre. They help prevent the plant being pulled out of the ground. They are also more protected in the centre. Whereas the stem has to resist being squashed and bent, and so it has the vascular bundles nearer to the edge to give the stem strength and support. The phloem vessels are made up of living cells. They transport sucrose and amino acids up and down the plant, depending upon where they are needed. Whereas, in the xylem the movement is just one way: from the roots up to the leaves. So we know that water and minerals go up the xylem, and amino acids and sucrose go up and down the phloem. But how? In the second part of this video we are going to look at the xylem and transpiration."
Study biology at Nord university,Ic-PkJNs3Io,biology,"Hi! I'm Rok. I'm from Slovenia and I study Biology at Nord University. I chose to study biology here  because in high school I - - found it very interesting, and I chose Nord University specifically - - because of the structure of the programme and what they offered - - and also because  of the city. When moving here and looking for accomodation it was quite easy - - because the people I contacted online was very helpful and can - - get you settled quite nicely and answer all your questions - - and you can always go to them if you have any problems - - in your first few weeks and they will always try to help you. The experience of being an international student here is - - very charming, mostly all activities on campus and clubs - - are very welcoming to international student joining the community - - and mostly everyone around here can speak english. Everyday life on campus is quite easy but also challenging - - in a way that it forces you to work a lot independently, - - but the teachers and staff are always here to assist you - - and your classes are very lenient so you will have free time to - - explore activities happening  on campus, around the city - - and even visit other  places nearby. My plans for the future is to continue with a masters degree - - what we're learning is so broad that I want to learn more about - - that I'm specifically interested in, and there's quite a few - - job opportunities that are available, like - - working as a consultant for a company or work in a lab - - or do your own research. I'm interested in working as - - a researcher or in a  laboratory, or maybe a teacher? I would enjoy teaching others about this lovely subject."
The Biology of Soil,sDMwJvxqqDQ,biology,"[Light, electronic music fades in.]  [Light, electronic music fades in.]  Dr. Claudia Goyer:  Soil is the home of a large variety of organisms... ...going from really large ones like insects and nematodes and earthworms... ...to the very small like bacteria and fungi. Narrator:  There are billions of organisms in every spoonful of soil. That means that there are more organisms in a spoonful of soil... ...than there are people on the planet.   They are very small but they are very important to maintain the chemical environment of our world. Dr. Claudia Goyer:  Soils are actually quite alive. Organisms play a big role in soils. They basically affect the chemical, the physical... ...and the biochemical properties of soil. Basically, all organisms are involved in recycling.   The process starts with larger organisms that will break down plant residue... ...and animal waste into smaller fragments and then the microorganism... ...will further break down these bigger fragments into nutrients... ...that can be taken up by plants. They play a vital role in keeping our soil really healthy... ...and ensuring that we're having a really good crop. Dr. Martin Chantigny:  Agricultural practices such as soil tillage, fertilization and crop rotation... ...affect the abundance and functioning of soil organisms. Dr. Claudia Goyer:  And all of those organisms very important for ecosystem functioning. Dr. Martin Chantigny:  Soil biological activity is active at temperatures well below freezing. Breakdown of plant material, manure, fertilizer, continues throughout winter... ..which affects nitrogen, phosphorus, carbon levels in soil and their fate in the ecosystem. Nutrient loses during winter may represent up to 90% total annual loses... ...which is far from being negligible.   This has an implication that the impact of fall application of manure and fertilizer may have on the environment.  Our goal is to develop farm management practices... ...that maximize retention of nutrients in the soil during winter... ...so we have a minimal impact on the environment and maximize the benefits to the next crop. Narrator:  These organisms are very important...  ...to get more food on our table. They are fundamentally essential to our life. Learn more about soil sciences in Canada... ...with our other videos on the chemistry, physics, and nutrients in soils. [Light, electronic music fades out.]"
Marine Biology and Zoology Student Tour,e3gysEKr7fw,biology,"Hi I'm Matt and I'm here to take you on a tour of the Marine Science building but first I thought I'd start off outside our great Student's Union building it's only a five minute walk away The majority of the campus-based teaching during the Marine Science degree takes place in the Ridley 2 Building Here we have both our larger lecture theatres for teaching core materials and our smaller Seminar Rooms for your chosen modules dependent on your specific aspirations as a Marine Biologist In addition to this we have our fully-equipped open plan, multi-purpose teaching laboratories for course practicals and demonstrations Furthermore, you'll have access to our cutting-edge customised research labs for specifically tailored purposes depending on your interest and end-goal in the world of Marine Science Finally, students get full access to our high-spec PC clusters which are installed with industry-leading software which features throughout the degree As part of the facilities at Newcastle University we also have our marine outstations The Blyth Marine Station - based at the port of Blyth supports the operation of our state of the art research vessel - the Princess Royal The Princess Royal was designed in-house by staff and students as a floating laboratory An 18 metre catamaran, the vessel has twin 600hp engines with a max cruising speed of 20 knots Trips out on the research vessel are an integral part of your studies you'll take part in a vaiety of activities including micro-plastic analysis, light attenuation with depth remote camera surveys of offshore habitats and trawling for biological samples Furthermore, there's a purpose built observation platform for marine mammal and seabird surveying Inside we have the wheelhouse this is where the skipper navigates the vessel Next to the wheelhouse is the dry lab it's equipped with benchtop PCs making it an ideal space to analyse data gathered at sea Trips out to sea on the Princess Royal really bring the subject to life and put the lecture content into a real world perspective Along the coast from Blyth is the Dove marine Laboratory in Cullercoats The Dove has a proud history of supporting excellence in marine science research, education and outreach for more than a century You'll visit the Dove throughout your degree it's a great location to learn survey and identification techniques while developing environmental assessment skills It has an aquarium that we use to comprehensively study live marine animals Recently we've had some exciting projects involving creatures such as large Dogfish and Lobsters This is made possible due to the real seawater that we have on-tap from the directly adjacent North Sea I hope you enjoyed our tour of the Marine Science facilities in the Ridley 2 Building Hope to see you soon!"
Pomona College Biology Professor Daniel Martinez on Gene Order Research,3sRA-wgP6cc,biology,"- [Narrator] Imagine four decks of cards, each with the same number of cards in identical order. Now imagine those card decks being shuffled continuously for 48 straight hours. What are the odds that when you finished all that shuffling, the cards in each deck would still be in the exact same order? Might not work for cards, but new research in the journal ""Science Advances"" reveals that after 700 million years of evolutionary forces, genes in animals are still found in the same order on chromosomes. The number of chromosomes varies widely across the animal kingdom. Humans have 23 pairs while fruit flies only have four. Dogs have way more chromosome pairs with 39 than cats with 19 pairs. No matter, the genes on the chromosomes are still arranged in the same order. Here's Pomona College biology professor and co-author of the study, Daniel Martinez, with a little more on this. - So it is an absolutely surprising finding. Chromosomes break all the time. They rearrange, they can get together and form another chromosome. I think that we expected there would be a lot more freedom from gene order to change. It is pretty amazing that animals have maintained gene order in chromosomes in such a neat way."
